slug,num,name_en,name_ja,short_desc_en,short_desc_ja,is_competitive,include,category
greninjaite,2416,Greninjaite,ゲッコウガナイト,"If held by a Greninja, this item allows it to Mega Evolve in battle.",ゲッコウガに持たせておくと戦いのときメガシンカができる不思議なメガストーンの一種。,,○,mega-stone
floettite,2417,Floettite,フラエッテナイト,"If held by a Floette-Eternal, this item allows it to Mega Evolve in battle.",フラエッテに持たせておくと戦いのときメガシンカができる不思議なメガストーンの一種。,,○,mega-stone
hawluchite,2418,Hawluchite,ルチャブルナイト,"If held by a Hawlucha, this item allows it to Mega Evolve in battle.",ルチャブルに持たせておくと戦いのときメガシンカができる不思議なメガストーンの一種。,,○,mega-stone
raichunite-x,2419,Raichunite X,ライチュウナイトＸ,"If held by an Alolan Raichu, this item allows it to Mega Evolve in battle.",ライチュウに持たせておくと戦いのときメガシンカができる不思議なメガストーンの一種。,,○,mega-stone
raichunite-y,2420,Raichunite Y,ライチュウナイトＹ,"If held by an Alolan Raichu, this item allows it to Mega Evolve in battle.",ライチュウに持たせておくと戦いのときメガシンカができる不思議なメガストーンの一種。,,○,mega-stone
